{
  "schema_version": "1.0",
  "plan_template_id": "Funding.Outreach.Email.Review@1.0.0",
  "intent_type": "Funding.Outreach.Email.Review",
  "plan_version": "planner-1.0",
  "description": "Review the current email (platform or override) and produce an Email.Review outcome.",
  "steps": [
    {
      "step_id": "s1",
      "kind": "operator",
      "name": "Platform.Context.Load",
      "operator_name": "Platform.Context.Load",
      "operator_version": "1.0.0",
      "effects": ["read_only"],
      "policy_tags": ["read_only", "platform_read"],
      "risk_level": "low",
      "cache_policy": "ttl_only",
      "idempotency_template": "platform_context:{tenant_id}:{thread_id}",
      "payload": { "thread_id": { "from": "intent.thread_id" } },
      "produces": ["context.platform"]
    },
    {
      "step_id": "s2",
      "kind": "policy_check",
      "name": "Ensure.Email.Present",
      "effects": ["read_only"],
      "policy_tags": ["requires_input"],
      "risk_level": "low",
      "cache_policy": "never",
      "check": {
        "check_name": "EnsureEmailPresent",
        "params": {
          "sources": [
            "intent.inputs.email_text_override",
            "context.platform.funding_request.email_content",
            "context.platform.email.main_email_body"
          ],
          "on_missing_action_type": "collect_fields"
        }
      }
    },
    {
      "step_id": "s3",
      "kind": "operator",
      "name": "Email.ReviewDraft",
      "operator_name": "Email.ReviewDraft",
      "operator_version": "1.0.0",
      "effects": ["produce_outcome"],
      "policy_tags": ["draft_only"],
      "risk_level": "low",
      "cache_policy": "use_if_safe",
      "idempotency_template": "email_review:{tenant_id}:{thread_id}:{computed.email_body_hash}",
      "payload": {
        "subject": { "from": "intent.inputs.email_subject_override" },
        "body": { "from": "intent.inputs.email_text_override" },
        "fallback_subject": { "from": "context.platform.funding_request.email_subject" },
        "fallback_body": { "from": "context.platform.funding_request.email_content" },
        "professor": { "from": "context.platform.professor" },
        "funding_request": { "from": "context.platform.funding_request" },
        "custom_instructions": { "from": "intent.inputs.custom_instructions" }
      },
      "produces": ["outcome.email_review"]
    }
  ]
}
