{
  "schema_version": "1.0",
  "plan_template_id": "Documents.Compose.SOP@1.0.0",
  "intent_type": "Documents.Compose.SOP",
  "plan_version": "planner-1.0",
  "description": "Ensure SOP prerequisites, compose an SOP draft, export as PDF, propose platform patch updates, and request approval to apply.",
  "steps": [
    {
      "step_id": "s1",
      "kind": "operator",
      "name": "Platform.Context.Load",
      "operator_name": "Platform.Context.Load",
      "operator_version": "1.0.0",
      "effects": ["read_only"],
      "policy_tags": ["read_only", "platform_read"],
      "risk_level": "low",
      "cache_policy": "ttl_only",
      "idempotency_template": "platform_context:{tenant_id}:{thread_id}",
      "payload": { "thread_id": { "from": "intent.thread_id" } },
      "produces": [
        "context.platform",
        "context.intelligence",
        "context.platform_context_hash",
        "context.student_background_hash",
        "context.composer_prereqs_hash"
      ]
    },
    {
      "step_id": "s2",
      "kind": "policy_check",
      "name": "Onboarding.EnsureComposerPrereqs",
      "effects": ["read_only"],
      "policy_tags": ["onboarding_gate"],
      "risk_level": "low",
      "cache_policy": "never",
      "check": {
        "check_name": "Onboarding.Ensure",
        "params": {
          "required_gates": ["base_profile_complete", "background_data_complete", "composer_prereqs_complete"],
          "on_missing_action_type": "collect_fields"
        }
      }
    },
    {
      "step_id": "s3",
      "kind": "operator",
      "name": "Professor.Profile.Retrieve",
      "operator_name": "Professor.Profile.Retrieve",
      "operator_version": "1.0.0",
      "effects": ["read_only"],
      "policy_tags": ["read_only", "public_web"],
      "risk_level": "low",
      "cache_policy": "ttl_only",
      "idempotency_template": "prof_profile:{tenant_id}:{context.platform.professor.id}:{context.platform.professor.canspider_digest_id}",
      "payload": {
        "professor_id": { "from": "context.platform.professor.id" },
        "professor_url": { "from": "intent.inputs.professor_ref.url" },
        "canspider_digest_id": { "from": "context.platform.professor.canspider_digest_id" },
        "force_refresh": { "const": false }
      },
      "produces": ["steps.s3.result.profile"]
    },
    {
      "step_id": "s4",
      "kind": "operator",
      "name": "Professor.Summarize",
      "operator_name": "Professor.Summarize",
      "operator_version": "1.0.0",
      "effects": ["produce_outcome"],
      "policy_tags": ["draft_only", "public_web"],
      "risk_level": "low",
      "cache_policy": "use_if_safe",
      "idempotency_template": "prof_summary:{tenant_id}:{context.platform.professor.id}:{steps.s3.result.profile.profile_hash.value}",
      "payload": {
        "professor_id": { "from": "context.platform.professor.id" },
        "profile": { "from": "steps.s3.result.profile" }
      },
      "produces": ["outcome.professor_summary"]
    },
    {
      "step_id": "s5",
      "kind": "operator",
      "name": "Documents.Compose.SOP",
      "operator_name": "Documents.Compose.SOP",
      "operator_version": "1.0.0",
      "effects": ["produce_outcome"],
      "policy_tags": ["documents", "draft_only", "pii_allowed"],
      "risk_level": "medium",
      "cache_policy": "use_if_safe",
      "idempotency_template": "sop_compose:{tenant_id}:{thread_id}:{context.platform.funding_request.id}:{outcome.professor_summary.hash.value}:{context.student_background_hash.value}:{context.composer_prereqs_hash.value}",
      "payload": {
        "student": { "from": "context.platform.student" },
        "funding_request": { "from": "context.platform.funding_request" },
        "professor": { "from": "context.platform.professor" },
        "professor_summary": { "from": "outcome.professor_summary" },
        "background": { "from": "context.intelligence.background" },
        "composer_prereqs": { "from": "context.intelligence.composer_prereqs" },
        "requested_topics": { "from": "intent.inputs.requested_topics" },
        "additional_notes": { "from": "intent.inputs.additional_notes" }
      },
      "produces": ["outcome.document_composed"]
    },
    {
      "step_id": "s6",
      "kind": "operator",
      "name": "Documents.Export",
      "operator_name": "Documents.Export",
      "operator_version": "1.0.0",
      "effects": ["produce_outcome", "s3_sandbox_write"],
      "policy_tags": ["documents"],
      "risk_level": "low",
      "cache_policy": "never",
      "idempotency_template": "doc_export:{tenant_id}:{thread_id}:{outcome.document_composed.hash.value}:pdf",
      "payload": {
        "optimized_document": { "from": "outcome.document_composed" },
        "export_format": { "const": "pdf" }
      },
      "produces": ["outcome.artifact_pdf"]
    },
    {
      "step_id": "s7",
      "kind": "operator",
      "name": "Documents.ApplyToPlatform.Propose",
      "operator_name": "Documents.ApplyToPlatform.Propose",
      "operator_version": "1.0.0",
      "effects": ["produce_outcome"],
      "policy_tags": ["apply_proposal", "platform_write"],
      "risk_level": "medium",
      "cache_policy": "never",
      "idempotency_template": "patch_proposal:{tenant_id}:{context.platform.student.id}:{outcome.artifact_pdf.hash.value}",
      "payload": {
        "student_id": { "from": "context.platform.student.id" },
        "funding_request_id": { "from": "context.platform.funding_request.id" },
        "document_type": { "const": "sop" },
        "artifact": { "from": "outcome.artifact_pdf" }
      },
      "produces": ["outcome.platform_patch_proposal"]
    },
    {
      "step_id": "s8",
      "kind": "human_gate",
      "name": "Apply.PlatformPatch",
      "effects": ["db_write_platform"],
      "policy_tags": ["apply", "platform_write"],
      "risk_level": "medium",
      "cache_policy": "never",
      "gate": {
        "gate_type": "apply_platform_patch",
        "reason_code": "REQUIRES_APPROVAL",
        "title": "Apply SOP to Documents",
        "description": "Apply the generated SOP artifact to your platform documents/attachments.",
        "requires_user_input": false,
        "ui_hints": { "primary_button": "Apply to Documents", "secondary_button": "Cancel" },
        "target_outcome_ref": { "from": "outcome.platform_patch_proposal" }
      }
    }
  ]
}
