{
  "schema_version": "1.0",
  "plan_template_id": "Funding.Outreach.Email.Optimize@1.0.0",
  "intent_type": "Funding.Outreach.Email.Optimize",
  "plan_version": "planner-1.0",
  "description": "Optimize the current email (platform or override), review it, propose platform patch updates, and request approval to apply.",
  "steps": [
    {
      "step_id": "s1",
      "kind": "operator",
      "name": "Platform.Context.Load",
      "operator_name": "Platform.Context.Load",
      "operator_version": "1.0.0",
      "effects": ["read_only"],
      "policy_tags": ["read_only", "platform_read"],
      "risk_level": "low",
      "cache_policy": "ttl_only",
      "idempotency_template": "platform_context:{tenant_id}:{thread_id}",
      "payload": { "thread_id": { "from": "intent.thread_id" } },
      "produces": [
        "context.platform",
        "context.intelligence",
        "context.platform_context_hash",
        "context.student_background_hash",
        "context.composer_prereqs_hash"
      ]
    },
    {
      "step_id": "s2",
      "kind": "policy_check",
      "name": "Ensure.Email.Present",
      "effects": ["read_only"],
      "policy_tags": ["requires_input"],
      "risk_level": "low",
      "cache_policy": "never",
      "check": {
        "check_name": "EnsureEmailPresent",
        "params": {
          "sources": [
            "intent.inputs.email_text_override",
            "context.platform.funding_request.email_content",
            "context.platform.email.main_email_body"
          ],
          "on_missing_action_type": "collect_fields"
        }
      }
    },
    {
      "step_id": "s3",
      "kind": "operator",
      "name": "Email.OptimizeDraft",
      "operator_name": "Email.OptimizeDraft",
      "operator_version": "1.0.0",
      "effects": ["produce_outcome"],
      "policy_tags": ["draft_only", "pii_allowed"],
      "risk_level": "low",
      "cache_policy": "use_if_safe",
      "idempotency_template": "email_optimize:{tenant_id}:{thread_id}:{computed.email_body_hash}:{computed.requested_edits_hash}:{intent.inputs.custom_instructions}",
      "payload": {
        "current_subject": { "from": "intent.inputs.email_subject_override" },
        "current_body": { "from": "intent.inputs.email_text_override" },
        "fallback_subject": { "from": "context.platform.funding_request.email_subject" },
        "fallback_body": { "from": "context.platform.funding_request.email_content" },
        "requested_edits": { "from": "intent.inputs.requested_edits" },
        "subject_override": { "from": "intent.inputs.subject_override" },
        "custom_instructions": { "from": "intent.inputs.custom_instructions" },
        "professor": { "from": "context.platform.professor" },
        "funding_request": { "from": "context.platform.funding_request" }
      },
      "produces": ["outcome.email_draft"]
    },
    {
      "step_id": "s4",
      "kind": "operator",
      "name": "Email.ReviewDraft",
      "operator_name": "Email.ReviewDraft",
      "operator_version": "1.0.0",
      "effects": ["produce_outcome"],
      "policy_tags": ["draft_only"],
      "risk_level": "low",
      "cache_policy": "use_if_safe",
      "idempotency_template": "email_review:{tenant_id}:{outcome.email_draft.outcome_id}",
      "payload": {
        "draft": { "from": "outcome.email_draft" },
        "professor": { "from": "context.platform.professor" },
        "funding_request": { "from": "context.platform.funding_request" }
      },
      "produces": ["outcome.email_review"]
    },
    {
      "step_id": "s5",
      "kind": "operator",
      "name": "Email.ApplyToPlatform.Propose",
      "operator_name": "Email.ApplyToPlatform.Propose",
      "operator_version": "1.0.0",
      "effects": ["produce_outcome"],
      "policy_tags": ["apply_proposal", "platform_write"],
      "risk_level": "medium",
      "cache_policy": "never",
      "idempotency_template": "patch_proposal:{tenant_id}:{context.platform.funding_request.id}:{outcome.email_draft.outcome_id}",
      "payload": {
        "funding_request_id": { "from": "context.platform.funding_request.id" },
        "email_id": { "from": "context.platform.email.id" },
        "draft": { "from": "outcome.email_draft" }
      },
      "produces": ["outcome.platform_patch_proposal"]
    },
    {
      "step_id": "s6",
      "kind": "human_gate",
      "name": "Apply.PlatformPatch",
      "effects": ["db_write_platform"],
      "policy_tags": ["apply", "platform_write"],
      "risk_level": "medium",
      "cache_policy": "never",
      "gate": {
        "gate_type": "apply_platform_patch",
        "reason_code": "REQUIRES_APPROVAL",
        "title": "Apply email changes",
        "description": "Apply the optimized email subject/body to your funding request (platform DB).",
        "requires_user_input": false,
        "ui_hints": { "primary_button": "Apply changes", "secondary_button": "Cancel" },
        "target_outcome_ref": { "from": "outcome.platform_patch_proposal" }
      }
    }
  ]
}
